{
  "schema_version": 1,
  "issue": "FAFF-1354",
  "build": {
    "status": "complete",
    "diff_hash": "0e28fa5eb9955fd613781ddf2ae198b9c078aaba8c1acd1bf6b44e476e0e506e",
    "branch": "FAFF-1354-a-suppressed-capture-names-the-event-type-kernel-and-rule",
    "pushed_at": "2026-10-21T02:47:34.116Z"
  },
  "updated_at": "2026-10-21T02:47:34.116Z"
}
