{
  "schema_version": 1,
  "issue": "FAFF-1249",
  "build": {
    "status": "complete",
    "diff_hash": "62b0089ea06ae629b93f244f019bf08d7676a6936145b0d60cfff0ede14e8026",
    "branch": "faff-1249-resume-from-the-built-but-not-admitted-hold",
    "pushed_at": "2026-10-27T18:26:33.054Z"
  },
  "updated_at": "2026-10-27T18:26:33.054Z"
}
