{
  "schema_version": 1,
  "issue": "FAFF-1347",
  "build": {
    "status": "complete",
    "diff_hash": "2c91bc42008beeed623fe7f50d6890ba707ccc254613a9f68578904c71333677",
    "branch": "faff-1347-scope-per-issue-anchor-judging",
    "pushed_at": "2026-10-27T01:26:05.827Z"
  },
  "updated_at": "2026-10-27T01:26:05.827Z"
}
